{
  "status": "refused",
  "exit_code_bucket": 30,
  "primary_error": {
    "code": "SANS_PARSE_SQL_DETECTED",
    "message": "proc sql detected; unsupported in v0.1; refusing to execute",
    "loc": {"file": "script.sas", "line_start": 1, "line_end": 1}
  },
  "diagnostics": [
    {
      "code": "SANS_PARSE_SQL_DETECTED",
      "message": "proc sql detected; unsupported in v0.1; refusing to execute",
      "loc": {"file": "script.sas", "line_start": 1, "line_end": 1}
    }
  ],
  "inputs": [
    {"path": "script.sas", "sha256": "b08e2d6ab3a6cf7b6e12ed8c3b1f8f1c5b2f7c93a61e32a7a0b6f0b1c3d6a2f4"}
  ],
  "outputs": [
    {"path": "out/plan.ir.json", "sha256": null},
    {"path": "out/report.json", "sha256": null}
  ],
  "plan_path": "out/plan.ir.json",
  "engine": {"name": "sans", "version": "0.1.0"},
  "settings": {
    "strict": true,
    "allow_approx": false,
    "tolerance": null,
    "tables": []
  },
  "timing": {"compile_ms": 1, "validate_ms": 0, "execute_ms": null},
  "runtime": {
    "status": "refused",
    "outputs": [],
    "timing": {"execute_ms": null}
  }
}
